{
  "ontologyVersion": "0.1",
  "id": "recipe.holographic_foil",
  "label": "Holographic Foil",
  "description": "Holographic Foil expressed only with shared Shader Grammar v0.1 primitives.",
  "materialFamilies": [
    "periodic_microstructure",
    "metallic_surface"
  ],
  "parameterValues": [
    {
      "parameter": "diffraction.spacing_nm",
      "value": 900,
      "modulatedBy": "f4_orientation"
    },
    {
      "parameter": "structure.anisotropy",
      "value": 1
    },
    {
      "parameter": "surface.metallic",
      "value": 0.92
    },
    {
      "parameter": "surface.roughness",
      "value": 0.14
    }
  ],
  "fieldInstances": [
    {
      "id": "f1_uv",
      "field": "field.uv"
    },
    {
      "id": "f2_normal",
      "field": "field.normal"
    },
    {
      "id": "f3_view_direction",
      "field": "field.view_direction"
    },
    {
      "id": "f4_orientation",
      "field": "field.orientation"
    },
    {
      "id": "f5_spectral_response",
      "field": "field.spectral_response"
    }
  ],
  "operatorInstances": [
    {
      "id": "o1_domain_warp",
      "operator": "op.domain_warp",
      "inputs": {
        "input": "f1_uv"
      }
    },
    {
      "id": "o2_diffraction_grating",
      "operator": "op.diffraction_grating",
      "inputs": {
        "input": "o1_domain_warp"
      }
    },
    {
      "id": "o3_spectral_to_rgb",
      "operator": "op.spectral_to_rgb",
      "inputs": {
        "input": "o2_diffraction_grating"
      }
    },
    {
      "id": "o4_reflection",
      "operator": "op.reflection",
      "inputs": {
        "input": "o3_spectral_to_rgb"
      }
    },
    {
      "id": "o5_layer_mix",
      "operator": "op.layer_mix",
      "inputs": {
        "input": "o4_reflection"
      }
    },
    {
      "id": "o6_tone_map",
      "operator": "op.tone_map",
      "inputs": {
        "input": "o5_layer_mix"
      }
    }
  ],
  "graph": [
    {
      "from": "f1_uv",
      "to": "o1_domain_warp",
      "semantic": "seed"
    },
    {
      "from": "o1_domain_warp",
      "to": "o2_diffraction_grating",
      "semantic": "pipeline"
    },
    {
      "from": "o2_diffraction_grating",
      "to": "o3_spectral_to_rgb",
      "semantic": "pipeline"
    },
    {
      "from": "o3_spectral_to_rgb",
      "to": "o4_reflection",
      "semantic": "pipeline"
    },
    {
      "from": "o4_reflection",
      "to": "o5_layer_mix",
      "semantic": "pipeline"
    },
    {
      "from": "o5_layer_mix",
      "to": "o6_tone_map",
      "semantic": "pipeline"
    }
  ],
  "outputs": {
    "baseColor": "o6_tone_map",
    "roughness": "parameter:surface.roughness"
  },
  "qualityTiers": {
    "preview": {
      "maxCost": "medium",
      "notes": "Reduce procedural octaves or spectral samples."
    },
    "production": {
      "maxCost": "very_high",
      "notes": "Use full spectral or volume integration where available."
    }
  },
  "limitations": [
    "Reference graph specifies semantics, not renderer-specific scheduling."
  ]
}
